{
	"missingMaterialCount": 2,
	"alphaPolicy": "opaque_scene_v1",
	"camera": {
		"aspectRatio": 1,
		"fieldOfViewDegrees": 90,
		"location": {
			"x": 0,
			"y": -200,
			"z": 0
		},
		"orthoWidth": 512,
		"projection": "perspective",
		"rotation": {
			"pitch": 0,
			"roll": 0,
			"yaw": 0
		},
		"usesCustomAspectRatio": false
	},
	"colorSpace": "srgb",
	"contract": {
		"name": "ue-shed-niagara-preview-receipt",
		"version": {
			"major": 1,
			"minor": 1
		}
	},
	"effectiveSettings": {
		"captureMode": "full_scene",
		"durationSeconds": 1,
		"frameCount": 2,
		"frameIntervalSeconds": 0.5,
		"height": 64,
		"playbackFramesPerSecond": 2,
		"simulationFramesPerSecond": 60,
		"startSeconds": 0,
		"width": 64,
		"renderMode": "scene",
		"cameraMode": "auto_fit",
		"sceneProfile": "ground_impact",
		"exposureCompensation": 1,
		"cameraPadding": 1.2
	},
	"engineVersion": "5.7.2-0+++UE5+Release-5.7",
	"frames": [
		{
			"index": 0,
			"maximumRgb": 1,
			"nonTransparentPixelFraction": 1,
			"relativePath": "frames/frame_0000.png",
			"timeSeconds": 0,
			"activityScore": 0.1,
			"edgePixelFraction": 0
		},
		{
			"index": 1,
			"maximumRgb": 0.8,
			"nonTransparentPixelFraction": 1,
			"relativePath": "frames/frame_0001.png",
			"timeSeconds": 0.5,
			"activityScore": 0.1,
			"edgePixelFraction": 0
		}
	],
	"generatedAtUtc": "2026-08-20T00:00:00.000Z",
	"requestedSettings": {
		"captureMode": "full_scene",
		"durationSeconds": 1,
		"frameCount": 2,
		"height": 64,
		"simulationFramesPerSecond": 60,
		"startSeconds": 0,
		"width": 64,
		"renderMode": "scene",
		"cameraMode": "auto_fit",
		"sceneProfile": "ground_impact",
		"exposureCompensation": 1,
		"cameraPadding": 1.2
	},
	"runId": "11111111-1111-4111-8111-111111111111",
	"status": "complete",
	"systemObjectPath": "/Game/Fixture/Niagara/NS_Preview.NS_Preview"
}
